{
  "$schema": "./tokens.schema.json",
  "version": 4,
  "contract": {
    "typography": {
      "display": "Amiri",
      "body": "Cardo",
      "ui": "Cardo"
    },
    "palette": "monochrome-editorial",
    "widths": {
      "home": "1520px",
      "standard": "1440px",
      "narrow": "860px"
    },
    "gutters": {
      "mobile": "20px",
      "tablet": "32px",
      "desktop": "48px"
    },
    "sectionRhythm": {
      "mobile": "48px",
      "desktop": "80px"
    }
  },
  "primitive": {
    "--ds-font-display": {
      "$value": "var(--font-amiri), var(--font-cardo), serif"
    },
    "--ds-font-body": {
      "$value": "var(--font-cardo), serif"
    },
    "--ds-font-ui": {
      "$value": "var(--ds-font-body)"
    },
    "--ds-font-label": {
      "$value": "var(--ds-font-ui)"
    },
    "--ds-weight-light": {
      "$value": "300"
    },
    "--ds-weight-regular": {
      "$value": "400"
    },
    "--ds-weight-medium": {
      "$value": "500"
    },
    "--ds-weight-semibold": {
      "$value": "600"
    },
    "--ds-weight-bold": {
      "$value": "700"
    },
    "--ds-leading-tight": {
      "$value": "1.2"
    },
    "--ds-leading-snug": {
      "$value": "1.375"
    },
    "--ds-leading-normal": {
      "$value": "1.5"
    },
    "--ds-leading-relaxed": {
      "$value": "1.625"
    },
    "--ds-tracking-tight": {
      "$value": "0em"
    },
    "--ds-tracking-normal": {
      "$value": "0em"
    },
    "--ds-tracking-wide": {
      "$value": "0.015em"
    },
    "--ds-tracking-wider": {
      "$value": "0.025em"
    },
    "--ds-terracotta-50": {
      "$value": "#FDF3EF"
    },
    "--ds-terracotta-100": {
      "$value": "#FADDD3"
    },
    "--ds-terracotta-200": {
      "$value": "#F4B8A4"
    },
    "--ds-terracotta-400": {
      "$value": "#D97F5E"
    },
    "--ds-terracotta-600": {
      "$value": "#C4603A"
    },
    "--ds-terracotta-800": {
      "$value": "#8F3D1F"
    },
    "--ds-terracotta-950": {
      "$value": "#5C2210"
    },
    "--ds-gold-50": {
      "$value": "#FAF5E9"
    },
    "--ds-gold-100": {
      "$value": "#F5EEDC"
    },
    "--ds-gold-400": {
      "$value": "#C9AE77"
    },
    "--ds-gold-600": {
      "$value": "#B89B5E"
    },
    "--ds-gold-800": {
      "$value": "#7A6335"
    },
    "--ds-parchment-50": {
      "$value": "#FDFAF6"
    },
    "--ds-parchment-100": {
      "$value": "#F5EFE6"
    },
    "--ds-parchment-200": {
      "$value": "#EDE8E0"
    },
    "--ds-parchment-300": {
      "$value": "#D9D0C4"
    },
    "--ds-ink-50": {
      "$value": "#9C8B7E"
    },
    "--ds-ink-100": {
      "$value": "#6B5E52"
    },
    "--ds-ink-200": {
      "$value": "#3D3530"
    },
    "--ds-ink-600": {
      "$value": "#1C1410"
    },
    "--ds-ink-900": {
      "$value": "#0E0A07"
    },
    "--ds-white-rgb": {
      "$value": "255, 255, 255"
    },
    "--ds-black-rgb": {
      "$value": "0, 0, 0"
    },
    "--ds-space-2xs": {
      "$value": "0.25rem"
    },
    "--ds-space-xs": {
      "$value": "0.5rem"
    },
    "--ds-space-sm": {
      "$value": "1rem"
    },
    "--ds-space-md": {
      "$value": "1.5rem"
    },
    "--ds-space-lg": {
      "$value": "2.5rem"
    },
    "--ds-space-xl": {
      "$value": "clamp(3rem, 5vw, 4.5rem)"
    },
    "--ds-space-2xl": {
      "$value": "clamp(4rem, 7vw, 6rem)"
    },
    "--ds-space-3xl": {
      "$value": "clamp(5rem, 9vw, 8rem)"
    },
    "--ds-radius-xs": {
      "$value": "2px"
    },
    "--ds-radius-sm": {
      "$value": "4px"
    },
    "--ds-radius-md": {
      "$value": "8px"
    },
    "--ds-radius-lg": {
      "$value": "12px"
    },
    "--ds-radius-pill": {
      "$value": "999px"
    },
    "--ds-z-dropdown": {
      "$value": "50"
    },
    "--ds-z-sticky": {
      "$value": "100"
    },
    "--ds-z-overlay": {
      "$value": "200"
    },
    "--ds-z-modal": {
      "$value": "300"
    },
    "--ds-transition-fast": {
      "$value": "150ms ease"
    },
    "--ds-transition-normal": {
      "$value": "220ms ease"
    },
    "--ds-transition": {
      "$value": "cubic-bezier(0.25, 0.46, 0.45, 0.94)"
    }
  },
  "semantic": {
    "--ds-text-display-xl": {
      "$value": "clamp(2.5rem, 5vw, 4rem)"
    },
    "--ds-text-display-lg": {
      "$value": "clamp(2rem, 3.5vw, 3rem)"
    },
    "--ds-text-display-md": {
      "$value": "clamp(1.5rem, 2.5vw, 2.25rem)"
    },
    "--ds-text-display-sm": {
      "$value": "clamp(1.25rem, 1.5vw, 1.5rem)"
    },
    "--ds-text-body-xl": {
      "$value": "clamp(1.125rem, 1.5vw, 1.25rem)"
    },
    "--ds-text-body-lg": {
      "$value": "1.125rem"
    },
    "--ds-text-body-md": {
      "$value": "1rem"
    },
    "--ds-text-body-sm": {
      "$value": "0.875rem"
    },
    "--ds-text-body-xs": {
      "$value": "0.75rem"
    },
    "--ds-text-count-xs": {
      "$value": "0.625rem"
    },
    "--ds-type-body-font": {
      "$value": "var(--ds-font-body)"
    },
    "--ds-type-heading-font": {
      "$value": "var(--ds-font-display)"
    },
    "--ds-type-ui-font": {
      "$value": "var(--ds-font-ui)"
    },
    "--ds-type-label-font": {
      "$value": "var(--ds-font-label)"
    },
    "--ds-type-body-weight": {
      "$value": "var(--ds-weight-regular)"
    },
    "--ds-type-light-weight": {
      "$value": "var(--ds-weight-light)"
    },
    "--ds-type-heading-weight": {
      "$value": "var(--ds-weight-regular)"
    },
    "--ds-type-subheading-weight": {
      "$value": "var(--ds-weight-regular)"
    },
    "--ds-type-ui-weight": {
      "$value": "var(--ds-weight-medium)"
    },
    "--ds-type-label-weight": {
      "$value": "var(--ds-weight-medium)"
    },
    "--ds-type-strong-weight": {
      "$value": "var(--ds-weight-semibold)"
    },
    "--ds-type-heading-transform": {
      "$value": "none"
    },
    "--ds-type-label-transform": {
      "$value": "none"
    },
    "--ds-type-button-transform": {
      "$value": "none"
    },
    "--ds-type-heading-tracking": {
      "$value": "var(--ds-tracking-normal)"
    },
    "--ds-type-body-tracking": {
      "$value": "var(--ds-tracking-normal)"
    },
    "--ds-type-label-tracking": {
      "$value": "var(--ds-tracking-wide)"
    },
    "--ds-type-button-tracking": {
      "$value": "var(--ds-tracking-wide)"
    },
    "--ds-type-product-title-font": {
      "$value": "var(--ds-font-body)"
    },
    "--ds-type-product-title-size": {
      "$value": "var(--ds-text-body-md)"
    },
    "--ds-type-product-title-weight": {
      "$value": "var(--ds-weight-medium)"
    },
    "--ds-type-product-meta-tracking": {
      "$value": "0.05em"
    },
    "--ds-type-product-meta-transform": {
      "$value": "uppercase"
    },
    "--ds-surface-page": {
      "$value": "#FFFFFF"
    },
    "--ds-surface-paper": {
      "$value": "#FFFFFF"
    },
    "--ds-surface-soft": {
      "$value": "#F7F7F7"
    },
    "--ds-surface-subtle": {
      "$value": "#F7F7F7"
    },
    "--ds-surface-warm": {
      "$value": "#F7F7F7"
    },
    "--ds-surface-parchment": {
      "$value": "#F7F7F7"
    },
    "--ds-surface-parchment-2": {
      "$value": "#E5E5E5"
    },
    "--ds-surface-dark": {
      "$value": "#000000"
    },
    "--ds-surface-darkest": {
      "$value": "#000000"
    },
    "--ds-text-primary": {
      "$value": "#000000"
    },
    "--ds-text-secondary": {
      "$value": "#333333"
    },
    "--ds-text-muted": {
      "$value": "#666666"
    },
    "--ds-text-disabled": {
      "$value": "#666666"
    },
    "--ds-text-inverse": {
      "$value": "#FFFFFF"
    },
    "--ds-text-on-dark": {
      "$value": "#FFFFFF"
    },
    "--ds-text-on-accent": {
      "$value": "#FFFFFF"
    },
    "--ds-text-price": {
      "$value": "#000000"
    },
    "--ds-text-price-old": {
      "$value": "#666666"
    },
    "--ds-accent-primary": {
      "$value": "#000000"
    },
    "--ds-accent-hover": {
      "$value": "#1A1A1A"
    },
    "--ds-accent-subtle": {
      "$value": "#E5E5E5"
    },
    "--ds-accent-focus": {
      "$value": "#333333"
    },
    "--ds-accent-soft": {
      "$value": "#F7F7F7"
    },
    "--ds-accent-rgb": {
      "$value": "0, 0, 0"
    },
    "--ds-accent-gold": {
      "$value": "var(--ds-gold-600)"
    },
    "--ds-accent-gold-soft": {
      "$value": "var(--ds-gold-100)"
    },
    "--ds-accent-gold-rgb": {
      "$value": "184, 155, 94"
    },
    "--ds-border-subtle": {
      "$value": "#E5E5E5"
    },
    "--ds-border-medium": {
      "$value": "#E5E5E5"
    },
    "--ds-border-strong": {
      "$value": "#333333"
    },
    "--ds-border-dark": {
      "$value": "#000000"
    },
    "--ds-text-primary-rgb": {
      "$value": "0, 0, 0"
    },
    "--ds-text-secondary-rgb": {
      "$value": "51, 51, 51"
    },
    "--ds-surface-page-rgb": {
      "$value": "255, 255, 255"
    },
    "--ds-surface-paper-rgb": {
      "$value": "255, 255, 255"
    },
    "--ds-surface-soft-rgb": {
      "$value": "247, 247, 247"
    },
    "--ds-surface-parchment-rgb": {
      "$value": "247, 247, 247"
    },
    "--ds-footer-bg": {
      "$value": "var(--ds-surface-dark)"
    },
    "--ds-footer-text": {
      "$value": "var(--ds-text-on-dark)"
    },
    "--ds-footer-heading": {
      "$value": "var(--ds-parchment-50)"
    },
    "--ds-footer-link": {
      "$value": "var(--ds-parchment-200)"
    },
    "--ds-footer-dim": {
      "$value": "var(--ds-gold-400)"
    },
    "--ds-footer-border": {
      "$value": "var(--ds-ink-200)"
    },
    "--ds-footer-highlight": {
      "$value": "var(--ds-accent-gold)"
    },
    "--ds-footer-surface": {
      "$value": "var(--ds-surface-darkest)"
    },
    "--ds-footer-muted": {
      "$value": "var(--ds-footer-dim)"
    },
    "--ds-footer-hover": {
      "$value": "var(--ds-footer-heading)"
    },
    "--ds-footer-highlight-hover": {
      "$value": "var(--ds-gold-100)"
    },
    "--ds-danger": {
      "$value": "#b91c1c"
    },
    "--ds-danger-bg": {
      "$value": "#fcebeb"
    },
    "--ds-danger-border": {